{
  "$schema": "https://json-schema.org/draft/2020-12/schema",
  "$id": "https://schemas.brikbyte.dev/verdict/v0/schema.json",
  "title": "BrikByteOS Verdict v0",
  "description": "Canonical final release-level decision contract for BrikByteOS after policy evaluation has completed.",
  "type": "object",
  "additionalProperties": false,
  "required": [
    "schema_family",
    "schema_version",
    "verdict",
    "decision_context",
    "policy_summary",
    "decided_at",
    "traceability"
  ],
  "properties": {
    "schema_family": {
      "type": "string",
      "const": "verdict",
      "description": "Stable schema family identity."
    },
    "schema_version": {
      "type": "string",
      "const": "v0",
      "description": "Explicit schema version namespace."
    },
    "verdict": {
      "type": "string",
      "enum": [
        "approved",
        "warning",
        "rejected"
      ],
      "description": "Stable final release-decision vocabulary."
    },
    "decision_context": {
      "$ref": "#/$defs/decision_context"
    },
    "policy_summary": {
      "$ref": "#/$defs/policy_summary"
    },
    "decided_at": {
      "type": "string",
      "format": "date-time",
      "description": "RFC3339 timestamp indicating when the final release decision was produced."
    },
    "traceability": {
      "$ref": "#/$defs/traceability"
    }
  },
  "$defs": {
    "decision_context": {
      "type": "object",
      "additionalProperties": false,
      "required": [
        "environment"
      ],
      "properties": {
        "environment": {
          "type": "string",
          "enum": [
            "dev",
            "staging",
            "production"
          ],
          "description": "Target environment or release context to which the verdict applies."
        },
        "target_id": {
          "type": "string",
          "minLength": 1,
          "description": "Optional stable identifier for the release candidate, build, deployment target, or evaluation unit."
        }
      },
      "description": "Final-decision context only. This must identify where the release decision applies."
    },
    "policy_summary": {
      "type": "object",
      "additionalProperties": false,
      "required": [
        "evaluated_count",
        "failed_count",
        "warning_count"
      ],
      "properties": {
        "evaluated_count": {
          "type": "integer",
          "minimum": 0,
          "description": "Total number of policy evaluations considered in this release decision."
        },
        "failed_count": {
          "type": "integer",
          "minimum": 0,
          "description": "Total number of failed policy evaluations contributing to the release decision."
        },
        "warning_count": {
          "type": "integer",
          "minimum": 0,
          "description": "Total number of warning-level policy evaluations contributing to the release decision."
        },
        "passed_count": {
          "type": "integer",
          "minimum": 0,
          "description": "Optional number of passed policy evaluations when explicitly useful for downstream consumers."
        }
      },
      "description": "Release-level rollup of policy outcomes only. This summary must not embed full policy result objects."
    },
    "traceability": {
      "type": "object",
      "additionalProperties": false,
      "required": [
        "policy_result_set_ref"
      ],
      "properties": {
        "policy_result_set_ref": {
          "type": "string",
          "minLength": 1,
          "description": "Reference or identifier for the set of policy evaluation results used to compute the verdict."
        },
        "normalized_result_set_ref": {
          "type": "string",
          "minLength": 1,
          "description": "Optional reference or identifier for the normalized evidence set used upstream."
        },
        "audit_bundle_ref": {
          "type": "string",
          "minLength": 1,
          "description": "Optional future-facing reference for audit bundle linkage without embedding the bundle itself."
        }
      },
      "description": "References to lower-layer artifacts for audit and traceability. Full lower-layer payloads are not embedded here."
    }
  }
}